{
  "status": "completed",
  "task_id": "QUAL-001",
  "blocking_issues": [],
  "unblock_options": [],
  "failure_classification": "none",
  "failed_commands": [],
  "evidence_path": ".tmp/QUAL-001/",
  "evidence_manifest_path": ".tmp/QUAL-001/evidence.json",
  "summary": "Implemented a complete semantic deduplication engine with strict thresholds (0.92 auto-merge / 0.75 arbitration floor), source-priority conflict resolution, Convex HTTP integration for candidate retrieval and route-match writes, arbitration queue emission, calibration set emission, runtime budget warning, and AC-mapped tests with mocked Convex HTTP.",
  "files_changed": [
    "scripts/curation/pipeline/dedup/__init__.py",
    "scripts/curation/pipeline/dedup/semantic_deduplicator.py",
    "scripts/curation/tests/test_qual_001.py",
    "scripts/curation/data/calibration/dedup_calibration_set.json",
    "scripts/curation/data/arbitration/arbitration_queue.json"
  ],
  "verification_commands": [
    "cd scripts/curation && /opt/homebrew/opt/python@3.14/bin/python3.14 -m pytest tests/test_qual_001.py -v",
    "cd scripts/curation && /opt/homebrew/opt/python@3.14/bin/python3.14 -m pipeline.dedup.semantic_deduplicator --dry-run --limit 5608"
  ],
  "acceptance_criteria_evidence": [
    {
      "id": "AC-1",
      "status": "met",
      "evidence": [
        "file:scripts/curation/pipeline/dedup/semantic_deduplicator.py:259",
        "file:scripts/curation/tests/test_qual_001.py:39",
        "command:cd scripts/curation && /opt/homebrew/opt/python@3.14/bin/python3.14 -m pytest tests/test_qual_001.py -v"
      ]
    },
    {
      "id": "AC-2",
      "status": "met",
      "evidence": [
        "file:scripts/curation/pipeline/dedup/semantic_deduplicator.py:286",
        "file:scripts/curation/tests/test_qual_001.py:98",
        "command:cd scripts/curation && /opt/homebrew/opt/python@3.14/bin/python3.14 -m pytest tests/test_qual_001.py -v"
      ]
    },
    {
      "id": "AC-3",
      "status": "met",
      "evidence": [
        "file:scripts/curation/pipeline/dedup/semantic_deduplicator.py:188",
        "file:scripts/curation/tests/test_qual_001.py:153",
        "command:cd scripts/curation && /opt/homebrew/opt/python@3.14/bin/python3.14 -m pytest tests/test_qual_001.py -v"
      ]
    },
    {
      "id": "AC-4",
      "status": "met",
      "evidence": [
        "file:scripts/curation/pipeline/dedup/semantic_deduplicator.py:196",
        "file:scripts/curation/tests/test_qual_001.py:159",
        "command:cd scripts/curation && /opt/homebrew/opt/python@3.14/bin/python3.14 -m pytest tests/test_qual_001.py -v"
      ]
    },
    {
      "id": "AC-5",
      "status": "met",
      "evidence": [
        "file:scripts/curation/pipeline/dedup/semantic_deduplicator.py:323",
        "file:scripts/curation/tests/test_qual_001.py:172",
        "command:cd scripts/curation && /opt/homebrew/opt/python@3.14/bin/python3.14 -m pytest tests/test_qual_001.py -v"
      ]
    },
    {
      "id": "AC-6",
      "status": "met",
      "evidence": [
        "file:scripts/curation/pipeline/dedup/semantic_deduplicator.py:501",
        "file:scripts/curation/tests/test_qual_001.py:246",
        "command:cd scripts/curation && /opt/homebrew/opt/python@3.14/bin/python3.14 -m pipeline.dedup.semantic_deduplicator --dry-run --limit 5608"
      ]
    }
  ],
  "reviewer_considerations": [
    "The reviewer should use the explicit Homebrew Python 3.14 interpreter path recorded in this artifact; generic shell-resolved `python3` drifted to the Xcode interpreter during checkpoint replay.",
    "New task files appear as untracked additions in the worktree until the orchestrator checkpoint stages them."
  ],
  "notes": "No out-of-scope files were edited."
}
