{
  "status": "completed",
  "task_id": "UC-MOL-02-android",
  "blocking_issues": [],
  "unblock_options": [],
  "failure_classification": "none",
  "failed_commands": [],
  "evidence_path": "inline://final-response",
  "evidence_manifest_path": "inline://final-response-manifest",
  "summary": "Fixed AC-1 by replacing the toolbar-height spacing-rung bridge with a dedicated component-toolbar token API (`56.dp`), kept LSToolbar and LSNavHeader on the corrected shared source, and updated the AC-1 unit test to assert canonical 56dp independently of `theme.toolbarComponentSizing.toolbarHeight`.",
  "files_changed": [
    "android/app/src/main/java/com/laneshadow/ui/molecules/LSToolbar.kt",
    "android/app/src/test/java/com/laneshadow/ui/molecules/LSToolbarTest.kt",
    "ai-specs/UC-MOL-02-android/android-learnings.md"
  ],
  "verification_commands": [
    "cd android && ./gradlew :app:testDebugUnitTest --tests \"com.laneshadow.ui.molecules.LSToolbarTest\" --tests \"com.laneshadow.ui.molecules.LSNavHeaderTest\"",
    "cd android && ./gradlew :app:assembleDebug",
    "cd android && ./gradlew :app:connectedDebugAndroidTest -Pandroid.testInstrumentationRunnerArguments.class=com.laneshadow.ui.molecules.LSToolbarUiTest"
  ],
  "acceptance_criteria_evidence": [
    {
      "id": "AC-1",
      "status": "met",
      "evidence": [
        "RED proof: `cd android && ./gradlew :app:testDebugUnitTest --tests \"com.laneshadow.ui.molecules.LSToolbarTest.default_render_uses_chrome_tokens\"` failed with `AssertionError at LSToolbarTest.kt:58` before production fix.",
        "GREEN production fix: `toolbarComponentSizing.toolbarHeight` now resolves from `ToolbarHeightComponentToken = 56.dp` (component token API), not `space.xxxxl`.",
        "Test proof: `default_render_uses_chrome_tokens` now asserts `expectedToolbarHeight = 56.dp` directly, independent of `theme.toolbarComponentSizing.toolbarHeight`."
      ]
    }
  ],
  "reviewer_considerations": [
    "Focus on `LSToolbar.kt` toolbar-height bridge at `ToolbarHeightComponentToken` and confirm it aligns with `component.toolbarHeight = 56` contract.",
    "Confirm LSNavHeader still consumes corrected value through `theme.toolbarComponentSizing.toolbarHeight` without behavior changes for AC-2..AC-6.",
    "Verify AC-1 test can no longer self-validate via shared helper."
  ],
  "notes": "Base SHA: 86f24f890661764f15a7532899954ef4fe3e9d56. Final commit SHA: a184130b921da542dd1bac2308635715c0d5bdf1. RED/GREEN captured as above. Instrumentation status: `:app:connectedDebugAndroidTest` passed on `Pixel_7_API_34(AVD)-14` (1 test, BUILD SUCCESSFUL). Pre-commit hook ran and passed (`android-typecheck`). Worktree is clean for task files; only harness-managed `.kb-run-sprint-codex/.state.json.sha256` remains modified per recovery note."
}