{
  "status": "completed",
  "task_id": "UC-ATM-05-android",
  "blocking_issues": [],
  "unblock_options": [],
  "failure_classification": "none",
  "failed_commands": [],
  "evidence_path": "/Users/justinrich/Projects/LaneShadow/.kb-run/tasks/UC-ATM-05-android/iterations/002/evidence.md",
  "evidence_manifest_path": "/Users/justinrich/Projects/LaneShadow/.kb-run/tasks/UC-ATM-05-android/iterations/002/evidence-manifest.json",
  "summary": "Completed the Android surface trio follow-up by resolving the surface fills through runtime theme values, keeping the callout stripe inside the clipped bounds, and replacing the self-blur approximation with a real backdrop source/effect path for LSGlassPanel. Targeted unit, compile, lint, release, and connected instrumentation checks passed before the branch was committed and cherry-picked to main.",
  "files_changed": [
    "android/app/build.gradle.kts",
    "android/app/src/main/java/com/laneshadow/ui/atoms/AccentColor.kt",
    "android/app/src/main/java/com/laneshadow/ui/atoms/GlassVariant.kt",
    "android/app/src/main/java/com/laneshadow/ui/atoms/LSCard.kt",
    "android/app/src/main/java/com/laneshadow/ui/atoms/LSPanel.kt",
    "android/app/src/main/java/com/laneshadow/ui/atoms/LSGlassPanel.kt",
    "android/app/src/debug/java/com/laneshadow/sandbox/stories/LSSurfaceStories.kt",
    "android/app/src/debug/java/com/laneshadow/sandbox/stories/AtomsStories.kt",
    "android/app/src/test/java/com/laneshadow/ui/atoms/LSCardTest.kt",
    "android/app/src/test/java/com/laneshadow/ui/atoms/LSPanelTest.kt",
    "android/app/src/test/java/com/laneshadow/ui/atoms/LSGlassPanelTest.kt",
    "android/app/src/androidTest/java/com/laneshadow/ui/atoms/LSGlassPanelInstrumentationTest.kt"
  ],
  "verification_commands": [
    "source ../scripts/agent-worktree-env.sh && ./gradlew :app:testDebugUnitTest --tests 'com.laneshadow.ui.atoms.LSCardTest' --tests 'com.laneshadow.ui.atoms.LSPanelTest' --tests 'com.laneshadow.ui.atoms.LSGlassPanelTest'",
    "source ../scripts/agent-worktree-env.sh && ./gradlew :app:compileDebugKotlin",
    "source ../scripts/agent-worktree-env.sh && ./gradlew :app:lint",
    "source ../scripts/agent-worktree-env.sh && ./gradlew :app:assembleRelease && APK=$(find app/build/outputs/apk/release -name '*.apk' | head -1) && test -n \"$APK\" && [ \"$(unzip -l \"$APK\" | grep -c com.nativesandbox || true)\" = \"0\" ]",
    "source ../scripts/agent-worktree-env.sh && ./gradlew :app:connectedDebugAndroidTest -Pandroid.testInstrumentationRunnerArguments.class=com.laneshadow.ui.atoms.LSGlassPanelInstrumentationTest"
  ],
  "acceptance_criteria_evidence": [
    {
      "id": "AC-1",
      "status": "met",
      "evidence": [
        "`LSCard.kt` resolves the surface fill from `theme.colors.card.default` and keeps radius/elevation/padding token-driven.",
        "`LSCardTest.kt` includes both the canonical token assertion and a dark-theme assertion."
      ]
    },
    {
      "id": "AC-2",
      "status": "met",
      "evidence": [
        "`LSPanel.kt` resolves the fill from `theme.colors.surface.default` with token-backed radius and padding.",
        "`LSPanelTest.kt` adds dark-theme coverage so the panel no longer hardwires the light palette."
      ]
    },
    {
      "id": "AC-3",
      "status": "met",
      "evidence": [
        "`LSGlassPanel.kt` now uses `LSGlassPanelBackdrop` plus `Modifier.hazeEffect(...)` when a backdrop source is available, while retaining API-aware fallback behavior when it is not.",
        "`LSGlassPanelInstrumentationTest.kt` renders the panel inside a real backdrop source and verifies the chrome panel resolves the expected blur metadata."
      ]
    },
    {
      "id": "AC-4",
      "status": "met",
      "evidence": [
        "`LSGlassPanel.kt` keeps the 3.dp callout stripe inside the clipped container bounds.",
        "`LSGlassPanelTest.kt` verifies width and canonical accent color resolution."
      ]
    },
    {
      "id": "AC-5",
      "status": "met",
      "evidence": [
        "`AccentColor.kt` resolves `.Signal` and `.Warning` from runtime theme values aligned with the canonical PRD.",
        "`LSGlassPanelTest.kt` verifies both callout accent mappings."
      ]
    },
    {
      "id": "AC-6",
      "status": "met",
      "evidence": [
        "`LSSurfaceStories.kt` registers the required card, panel, chrome glass, and callout stories.",
        "The stories render inside `LSGlassPanelBackdrop` so the sandbox demonstrates the real blur path."
      ]
    },
    {
      "id": "AC-7",
      "status": "met",
      "evidence": [
        "`resolveGlassBlurStrategy(30)` still falls back to the non-RenderEffect path.",
        "Connected instrumentation passed after the emulator-backed rerun."
      ]
    },
    {
      "id": "AC-8",
      "status": "met",
      "evidence": [
        "The surface atom files remain free of forbidden literal color, icon, and font references.",
        "The task-specific lint/typecheck/test gates passed."
      ]
    },
    {
      "id": "AC-9",
      "status": "met",
      "evidence": [
        "Release assemble passed.",
        "The APK inspection gate found zero `com.nativesandbox` entries."
      ]
    }
  ],
  "reviewer_considerations": [
    "The glass token is still derived from the runtime theme's card surface with glass alpha because the current Android semantic token DTO does not expose a dedicated `surface.glass` group, but the resulting light and dark values now track the active theme rather than hardwiring the light generated token set.",
    "The blur dependency added is `dev.chrisbanes.haze:haze:1.7.1`; the docs mention `haze-blur`, but that artifact was not present on Maven Central in this environment."
  ],
  "notes": "Committed in the task worktree as 0723269d after the earlier surface trio commits c083abaf and b57bdebf, then cherry-picked to main as 275fedd5, 1a25cac0, and a75922cf."
}
