{
  "status": "completed",
  "task_id": "UC-MOL-02-ios",
  "blocking_issues": [],
  "unblock_options": [],
  "failure_classification": "pre_existing",
  "failed_commands": [
    "swiftformat --lint ios/LaneShadow/ (fails on pre-existing file ios/LaneShadow/Views/Atoms/LSMapUIViewRepresentable.swift:66)"
  ],
  "evidence_path": "/tmp/uc-mol-02-fulltest.log",
  "evidence_manifest_path": "/tmp/uc-mol-02-evidence-manifest.txt",
  "summary": "Implemented LSToolbar and LSNavHeader molecules with token-driven styling, safe-area handling, atom composition, new molecule stories (4 toolbar + 3 navheader), test coverage for AC-targeted behavior and story registration, XcodeGen wiring via ios/project.yml regeneration, and iOS learnings at ai-specs/UC-MOL-02/ios-learnings.md. Commit created and worktree is clean.",
  "files_changed": [
    "ai-specs/UC-MOL-02/ios-learnings.md",
    "ios/LaneShadow.xcodeproj/project.pbxproj",
    "ios/LaneShadow/Sandbox/Stories/Molecules/LSNavHeaderStory.swift",
    "ios/LaneShadow/Sandbox/Stories/Molecules/LSToolbarStory.swift",
    "ios/LaneShadow/Sandbox/Stories/MoleculesStories.swift",
    "ios/LaneShadow/Views/Molecules/LSNavHeader.swift",
    "ios/LaneShadow/Views/Molecules/LSToolbar.swift",
    "ios/LaneShadowTests/Molecules/LSNavHeaderTests.swift",
    "ios/LaneShadowTests/Molecules/LSToolbarTests.swift",
    "ios/project.yml"
  ],
  "verification_commands": [
    "bash scripts/ios/generate-project.sh",
    "cd ios && xcodebuild test -scheme LaneShadow -destination 'platform=iOS Simulator,name=iPhone 16' -only-testing:LaneShadowTests/LSToolbarTests/test_default_render_uses_surface_primary_and_slot_atoms 2>&1 | grep 'TEST SUCCEEDED'",
    "cd ios && xcodebuild test -scheme LaneShadow -destination 'platform=iOS Simulator,name=iPhone 16' -only-testing:LaneShadowTests/LSNavHeaderTests/test_large_title_uses_opinion_lg_typography 2>&1 | grep 'TEST SUCCEEDED'",
    "cd ios && xcodebuild test -scheme LaneShadow -destination 'platform=iOS Simulator,name=iPhone 16' -only-testing:LaneShadowTests/LSNavHeaderTests/test_default_variant_uses_ui_title_md 2>&1 | grep 'TEST SUCCEEDED'",
    "cd ios && xcodebuild test -scheme LaneShadow -destination 'platform=iOS Simulator,name=iPhone 16' -only-testing:LaneShadowTests/LSToolbarTests/test_all_seven_toolbar_navheader_stories_registered 2>&1 | grep 'TEST SUCCEEDED'",
    "grep -n 'safeAreaInset\\|safeAreaPadding\\|ignoresSafeArea' ios/LaneShadow/Views/Molecules/LSToolbar.swift | wc -l | xargs test 0 -lt",
    "grep -n 'Color(red:\\|Color(hex:\\|Font.system\\|foregroundColor(' ios/LaneShadow/Views/Molecules/LSToolbar.swift ios/LaneShadow/Views/Molecules/LSNavHeader.swift | wc -l | xargs test 0 -eq",
    "swiftformat --lint ios/LaneShadow/Views/Molecules/LSToolbar.swift ios/LaneShadow/Views/Molecules/LSNavHeader.swift",
    "cd ios && xcodebuild build -scheme LaneShadow -destination 'platform=iOS Simulator,name=iPhone 16' 2>&1 | grep 'BUILD SUCCEEDED'",
    "cd ios && xcodebuild test -scheme LaneShadow -destination 'platform=iOS Simulator,name=iPhone 16' 2>&1 | grep 'TEST SUCCEEDED'",
    "xcrun simctl io 'iPhone 16' screenshot /tmp/laneshadow-evidence/uc-mol-02-ios-simulator.png"
  ],
  "acceptance_criteria_evidence": [
    {
      "id": "AC-1",
      "status": "met",
      "evidence": [
        "Targeted test passed: LaneShadowTests/LSToolbarTests/test_default_render_uses_surface_primary_and_slot_atoms",
        "Log: /tmp/uc-mol-02-ac1.log"
      ]
    },
    {
      "id": "AC-2",
      "status": "met",
      "evidence": [
        "safeAreaInset gate passed on ios/LaneShadow/Views/Molecules/LSToolbar.swift (AC2_OK)"
      ]
    },
    {
      "id": "AC-3",
      "status": "met",
      "evidence": [
        "Targeted test passed: LaneShadowTests/LSNavHeaderTests/test_large_title_uses_opinion_lg_typography",
        "Log: /tmp/uc-mol-02-ac3.log"
      ]
    },
    {
      "id": "AC-4",
      "status": "met",
      "evidence": [
        "Targeted test passed: LaneShadowTests/LSNavHeaderTests/test_default_variant_uses_ui_title_md",
        "Log: /tmp/uc-mol-02-ac4.log"
      ]
    },
    {
      "id": "AC-5",
      "status": "met",
      "evidence": [
        "Forbidden API grep gate passed for LSToolbar.swift and LSNavHeader.swift (AC5_OK)",
        "swiftformat lint passed for both new molecule files"
      ]
    },
    {
      "id": "AC-6",
      "status": "met",
      "evidence": [
        "Targeted story-registration test passed: LaneShadowTests/LSToolbarTests/test_all_seven_toolbar_navheader_stories_registered",
        "Log: /tmp/uc-mol-02-ac6.log"
      ]
    }
  ],
  "reviewer_considerations": [
    "TypographyVariant.ui/opinion are implemented as a local extension in LSNavHeader.swift; validate whether this should be centralized in Atoms/TypographyVariant.swift later.",
    "Toolbar uses icon-only ghost buttons via LSButton with overlayed LSIcon to satisfy atom-composition and icon-size requirements; verify accessibility labels and hit areas in interactive QA.",
    "Post-commit hook reports missing .git/hooks/add-to-xcode.rb in this environment (non-blocking here) and may need harness-level cleanup."
  ],
  "notes": "Base SHA: 800c6ebfd41edb0869e590849f8eefb8721fbe4e. Final commit SHA: 01b44c51bb1c9081a2c70e80783bc86d2dfb0a6a. RED evidence: initial targeted xcodebuild failed before implementation with compile failure in LSToolbar stub ('cannot find type IconName in scope'), then greened after implementation/refactors. Full scheme tests/build succeeded. Simulator screenshot path: /tmp/laneshadow-evidence/uc-mol-02-ios-simulator.png."
}