{"status":"blocked","task_id":"UC-ATM-07-ios","blocking_issues":["A pre-existing top-level `BadgeVariant` already exists in `ios/LaneShadow/Views/Atoms/Badge.swift`, but this task requires a different top-level `BadgeVariant` API (`.status(...)` and `.weather(...)`).","`ios/LaneShadow/Views/Atoms/Badge.swift` is outside `SCOPE.writeAllowed`, so the conflicting existing type cannot be renamed, removed, or adapted within the allowed write set.","Swift cannot compile two top-level types with the same name in the same module, so the required deliverable cannot be implemented without a scope correction."],"unblock_options":["Allow edits to `ios/LaneShadow/Views/Atoms/Badge.swift` so the existing `BadgeVariant` can be renamed or replaced and downstream consumers updated.","Revise the task contract to use a non-conflicting type name such as `LSBadgeVariant` instead of `BadgeVariant`.","Broaden scope to include the existing old badge atom and its consumers/tests so the module can be migrated to the new badge API coherently."],"failure_classification":"pre_existing","failed_commands":["source scripts/agent-worktree-env.sh && cd ios && xcodebuild test -scheme LaneShadow -destination 'platform=iOS Simulator,name=iPhone 16' -only-testing:LaneShadowTests/LSBadgeTests/test_status_recording_resolves_tokens","source scripts/agent-worktree-env.sh && cd ios && xcodebuild test -scheme LaneShadow -destination 'platform=iOS Simulator,name=iPhone 16' -derivedDataPath \"$DERIVED_DATA_PATH\" -clonedSourcePackagesDirPath \"$SWIFTPM_CACHE_DIR\" -only-testing:LaneShadowTests/LSBadgeTests/test_status_recording_resolves_tokens","source scripts/agent-worktree-env.sh && cd ios && xcodebuild test -scheme LaneShadow -destination 'platform=iOS Simulator,name=iPhone 16' -derivedDataPath \"$DERIVED_DATA_PATH\" -clonedSourcePackagesDirPath \"$SWIFTPM_CACHE_DIR\" -only-testing:LaneShadowTests/LSBestBadgeTests/test_best_badge_resolves_signal_tokens_and_filled_star"],"evidence_path":"/Users/justinrich/Projects/LaneShadow/.kb-run/tasks/UC-ATM-07-ios/iterations/002/evidence.md","evidence_manifest_path":"/Users/justinrich/Projects/LaneShadow/.kb-run/tasks/UC-ATM-07-ios/iterations/002/evidence-manifest.json","summary":"Restored the orchestrator-owned state checksum file so the worktree is back in host-valid state. The task remains blocked after RED-phase test scaffolding because the module already contains an out-of-scope top-level `BadgeVariant`, which conflicts with the required new `BadgeVariant.status/.weather` API.","files_changed":["ios/LaneShadowTests/Atoms/LSBadgeTests.swift","ios/LaneShadowTests/Atoms/LSBestBadgeTests.swift","/Users/justinrich/Projects/LaneShadow/.kb-run/tasks/UC-ATM-07-ios/iterations/002/evidence.md","/Users/justinrich/Projects/LaneShadow/.kb-run/tasks/UC-ATM-07-ios/iterations/002/evidence-manifest.json"],"verification_commands":["git restore -- .kb-run-sprint-codex/.state.json.sha256 && git status --short","source scripts/agent-worktree-env.sh && cd ios && xcodebuild test -scheme LaneShadow -destination 'platform=iOS Simulator,name=iPhone 16' -derivedDataPath \"$DERIVED_DATA_PATH\" -clonedSourcePackagesDirPath \"$SWIFTPM_CACHE_DIR\" -only-testing:LaneShadowTests/LSBadgeTests/test_status_recording_resolves_tokens","rg -n '^public enum BadgeVariant|^enum BadgeVariant|BadgeVariant' ios/LaneShadow/Views/Atoms/Badge.swift ios/LaneShadow ios/LaneShadowTests | sed -n '1,120p'"],"acceptance_criteria_evidence":[{"id":"AC-1","status":"not_met","evidence":["Added RED test `ios/LaneShadowTests/Atoms/LSBadgeTests.swift` covering `test_status_recording_resolves_tokens`.","Isolated xcodebuild reached compilation and failed because `LSBadge` does not exist and the required typed `BadgeVariant.status(.recording)` API conflicts with the pre-existing top-level `BadgeVariant` in `ios/LaneShadow/Views/Atoms/Badge.swift`."]},{"id":"AC-2","status":"not_met","evidence":["Added RED test coverage for status variants in `ios/LaneShadowTests/Atoms/LSBadgeTests.swift`.","Compilation failed before GREEN because `BadgeVariant.status(...)` cannot be introduced while the existing out-of-scope `BadgeVariant` already occupies the same top-level name."]},{"id":"AC-3","status":"not_met","evidence":["Added RED test coverage for weather rain token/icon resolution in `ios/LaneShadowTests/Atoms/LSBadgeTests.swift`.","`LSBadge` and the required weather-capable `BadgeVariant` API are absent; implementation is blocked by the pre-existing name collision outside scope."]},{"id":"AC-4","status":"not_met","evidence":["Added RED test coverage for weather wind token/icon resolution in `ios/LaneShadowTests/Atoms/LSBadgeTests.swift`.","The module cannot accept the required new `BadgeVariant.weather(...)` top-level API without changing `ios/LaneShadow/Views/Atoms/Badge.swift`, which is not writable in this task."]},{"id":"AC-5","status":"not_met","evidence":["Added RED test `ios/LaneShadowTests/Atoms/LSBestBadgeTests.swift` covering `test_best_badge_resolves_signal_tokens_and_filled_star`.","xcodebuild compile failed with `Cannot find 'LSBestBadge' in scope`; implementation was not possible to continue because the shared badge type contract is blocked at the module level by the existing `BadgeVariant`."]},{"id":"AC-6","status":"not_met","evidence":["Story registration work was not started because the product API could not be introduced safely under the current scope.","No valid GREEN implementation exists yet for `LSBadgeStories` or `LaneShadowStories` wiring."]},{"id":"AC-7","status":"not_met","evidence":["`ios/LaneShadow/Views/Atoms/LSBadge.swift` was not created because the task blocked before implementation.","The composition grep gate could not be satisfied without first resolving the pre-existing `BadgeVariant` conflict."]},{"id":"AC-8","status":"not_met","evidence":["`ios/LaneShadow/Views/Atoms/LSBadge.swift` and `ios/LaneShadow/Views/Atoms/LSBestBadge.swift` were not created because implementation was blocked.","The SF Symbol grep gate was therefore not reached."]}],"reviewer_considerations":["The orchestrator-owned state checksum file `.kb-run-sprint-codex/.state.json.sha256` was restored; current `git status --short` shows only the two intended RED test files as untracked product changes.","The blocker is structural and pre-existing: `ios/LaneShadow/Views/Atoms/Badge.swift:81` already defines `public enum BadgeVariant: String, CaseIterable`.","The first xcodebuild attempt failed during package resolution because the isolated DerivedData/SPM flags were omitted; the second isolated run reached the real blocker and should be treated as the authoritative RED evidence.","Once scope is corrected, the current RED tests can be reused as the starting point for a normal RED -> GREEN -> REFACTOR implementation cycle."],"notes":"Worktree state integrity has been restored. Unrelated host-owned state files are now clean; remaining product changes are limited to the RED test scaffolding and evidence artifacts."}